,Name,Country,Years active,Possible victims(Updated),Proven victims(Updated),Notes
299,John Wayne Gacy,United States,1972 to 1978,34,33,"Known to have murdered a minimum of 33 teenage boys and young men between 1972 and 1978, 26 of whom he buried in the crawl space of his Chicago home. Gacy was known as the ""Killer Clown"" due to the fact he often entertained children at social events dressed in a self devised clown costume. Executed by lethal injection in 1994."
300,Ali Asghar Borujerdi,"Ottoman Empire,Iraq,Iran",1907 to 1934,33,33,"Known as ""Asghar the Murderer"". Killed 33 young adults in Iraq and Iran. Executed by hanging in 1934."
301,Vasili Komaroff,Soviet Union,1921 to 1923,33,33,"Known as ""The Wolf of Moscow""; horse trader who killed 33 men. Executed by firing squad in 1923."
302,Fernando Hernandez Leyva,Mexico,1982 to 1999,100,33,"Confessed to 100 murders and six kidnappings at the time of his arrest in 1999 (he had been arrested previously in 1982 and 1986, the second time for murder, but escaped from prison), but later retracted and claimed that he had been beaten by the police and his family threatened in order to force him to confess. Accused of as many as 137 murders in five southern Mexican states, convicted of 33 murders and sentenced 50 years in prison. Tried unsuccessfully to kill himself in prison. If his claim of 100 victims were true then Leyva would be Mexico's most prolific documented serial killer."
303,Ramadan Abdel Rehim Mansour,Egypt,1999 to 2006,32,32,"Gang leader known as al-Tourbini (""The Express Train""). Raped and tortured homeless children, mostly boys aged 10 to 14 years old, aboard the trains between Cairo, Alexandria, Qalyubia and Beni Sueif. The victims were usually thrown off the moving train when they were dead or in agony; other times they were thrown into the Nile or buried alive. Executed in 2010."
304,Radik Tagirov,Russia,2011 to 2012,32,32,"Serial killer called Radik Tagirov who murdered elderly women in several Russian regions; Kazakhstani native Pavel Shayakhmetov, found guilty of killing two elderly women in Samara, was arrested on suspicion of committing these murders [46]"
